{
  "$schema": "../challenge-settlement-request.schema.json",
  "settlement_run_id": "aoe2hdbets:challenge-44:v1",
  "source_app": "aoe2hdbets",
  "challenge_id": "44",
  "treasury_address": "wolo1treasury000000000000000000000000000000",
  "note": "AoE2HDBets decided the match was played and left won",
  "memo": "challenge-44 played left-wins",
  "funding": [
    {
      "funding_tx_hash": "5555555555555555555555555555555555555555555555555555555555555555",
      "depositor_address": "wolo1leftplayer0000000000000000000000000000",
      "settlement_run_id": "aoe2hdbets:challenge-44:v1",
      "participant_side": "left",
      "expected_amount_uwolo": "1500000",
      "wager_uwolo": "1000000",
      "guarantee_uwolo": "500000"
    },
    {
      "funding_tx_hash": "6666666666666666666666666666666666666666666666666666666666666666",
      "depositor_address": "wolo1rightplayer000000000000000000000000000",
      "settlement_run_id": "aoe2hdbets:challenge-44:v1",
      "participant_side": "right",
      "expected_amount_uwolo": "1500000",
      "wager_uwolo": "1000000",
      "guarantee_uwolo": "500000"
    }
  ],
  "transfers": [
    {
      "request_id": "aoe2hdbets:challenge-44:left-guarantee-return",
      "participant_side": "left",
      "bucket": "guarantee",
      "reason": "return",
      "to_address": "wolo1leftplayer0000000000000000000000000000",
      "amount_uwolo": "500000",
      "memo": "challenge-44 left guarantee return"
    },
    {
      "request_id": "aoe2hdbets:challenge-44:right-guarantee-return",
      "participant_side": "right",
      "bucket": "guarantee",
      "reason": "return",
      "to_address": "wolo1rightplayer000000000000000000000000000",
      "amount_uwolo": "500000",
      "memo": "challenge-44 right guarantee return"
    },
    {
      "request_id": "aoe2hdbets:challenge-44:left-wager-payout",
      "participant_side": "left",
      "bucket": "wager",
      "reason": "release",
      "to_address": "wolo1leftplayer0000000000000000000000000000",
      "amount_uwolo": "1000000",
      "memo": "challenge-44 left wager payout"
    },
    {
      "request_id": "aoe2hdbets:challenge-44:right-wager-payout",
      "participant_side": "right",
      "bucket": "wager",
      "reason": "release",
      "to_address": "wolo1leftplayer0000000000000000000000000000",
      "amount_uwolo": "1000000",
      "memo": "challenge-44 right wager payout"
    }
  ]
}
