{
  "$schema": "../challenge-settlement-request.schema.json",
  "settlement_run_id": "aoe2hdbets:challenge-45:v1",
  "source_app": "aoe2hdbets",
  "challenge_id": "45",
  "treasury_address": "wolo1treasury000000000000000000000000000000",
  "note": "AoE2HDBets canceled before play and requested full refunds",
  "memo": "challenge-45 canceled",
  "funding": [
    {
      "funding_tx_hash": "7777777777777777777777777777777777777777777777777777777777777777",
      "depositor_address": "wolo1leftplayer0000000000000000000000000000",
      "settlement_run_id": "aoe2hdbets:challenge-45:v1",
      "participant_side": "left",
      "expected_amount_uwolo": "1500000",
      "wager_uwolo": "1000000",
      "guarantee_uwolo": "500000"
    },
    {
      "funding_tx_hash": "8888888888888888888888888888888888888888888888888888888888888888",
      "depositor_address": "wolo1rightplayer000000000000000000000000000",
      "settlement_run_id": "aoe2hdbets:challenge-45:v1",
      "participant_side": "right",
      "expected_amount_uwolo": "1500000",
      "wager_uwolo": "1000000",
      "guarantee_uwolo": "500000"
    }
  ],
  "transfers": [
    {
      "request_id": "aoe2hdbets:challenge-45:left-guarantee-refund",
      "participant_side": "left",
      "bucket": "guarantee",
      "reason": "refund",
      "to_address": "wolo1leftplayer0000000000000000000000000000",
      "amount_uwolo": "500000",
      "memo": "challenge-45 left guarantee refund"
    },
    {
      "request_id": "aoe2hdbets:challenge-45:left-wager-refund",
      "participant_side": "left",
      "bucket": "wager",
      "reason": "refund",
      "to_address": "wolo1leftplayer0000000000000000000000000000",
      "amount_uwolo": "1000000",
      "memo": "challenge-45 left wager refund"
    },
    {
      "request_id": "aoe2hdbets:challenge-45:right-guarantee-refund",
      "participant_side": "right",
      "bucket": "guarantee",
      "reason": "refund",
      "to_address": "wolo1rightplayer000000000000000000000000000",
      "amount_uwolo": "500000",
      "memo": "challenge-45 right guarantee refund"
    },
    {
      "request_id": "aoe2hdbets:challenge-45:right-wager-refund",
      "participant_side": "right",
      "bucket": "wager",
      "reason": "refund",
      "to_address": "wolo1rightplayer000000000000000000000000000",
      "amount_uwolo": "1000000",
      "memo": "challenge-45 right wager refund"
    }
  ]
}
