{
  "$schema": "../challenge-settlement-request.schema.json",
  "settlement_run_id": "aoe2hdbets:challenge-43:double-noshow:v1",
  "source_app": "aoe2hdbets",
  "challenge_id": "challenge-43",
  "source_event_id": "match-2026-04-20-00043",
  "treasury_address": "wolo1treasury000000000000000000000000000000",
  "note": "AoE2HDBets decided both players no-showed",
  "memo": "challenge-43 double-noshow",
  "funding": [
    {
      "funding_tx_hash": "3333333333333333333333333333333333333333333333333333333333333333",
      "depositor_address": "wolo1leftplayer0000000000000000000000000000",
      "participant_side": "left",
      "participant_id": "aoe2-user-left"
    },
    {
      "funding_tx_hash": "4444444444444444444444444444444444444444444444444444444444444444",
      "depositor_address": "wolo1rightplayer000000000000000000000000000",
      "participant_side": "right",
      "participant_id": "aoe2-user-right"
    }
  ],
  "transfers": [
    {
      "request_id": "aoe2hdbets:challenge-43:left-guarantee-treasury",
      "participant_side": "left",
      "participant_id": "aoe2-user-left",
      "bucket": "guarantee",
      "reason": "treasury",
      "to_address": "wolo1treasury000000000000000000000000000000",
      "amount_uwolo": "500000",
      "memo": "challenge-43 left guarantee treasury"
    },
    {
      "request_id": "aoe2hdbets:challenge-43:right-guarantee-treasury",
      "participant_side": "right",
      "participant_id": "aoe2-user-right",
      "bucket": "guarantee",
      "reason": "treasury",
      "to_address": "wolo1treasury000000000000000000000000000000",
      "amount_uwolo": "500000",
      "memo": "challenge-43 right guarantee treasury"
    },
    {
      "request_id": "aoe2hdbets:challenge-43:left-wager-refund",
      "participant_side": "left",
      "participant_id": "aoe2-user-left",
      "bucket": "wager",
      "reason": "refund",
      "to_address": "wolo1leftplayer0000000000000000000000000000",
      "amount_uwolo": "1000000",
      "memo": "challenge-43 left wager refund"
    },
    {
      "request_id": "aoe2hdbets:challenge-43:right-wager-refund",
      "participant_side": "right",
      "participant_id": "aoe2-user-right",
      "bucket": "wager",
      "reason": "refund",
      "to_address": "wolo1rightplayer000000000000000000000000000",
      "amount_uwolo": "1000000",
      "memo": "challenge-43 right wager refund"
    }
  ]
}
